{
  "free_result": {
    "temperature_score": 25,
    "state_label": "冷處理觀望",
    "one_sentence_read": "他暫時選擇不回應，而你在等待中保持表面平靜，但內心其實很在意這個沉默。",
    "observed_signals": [
      "已讀後沒有回覆",
      "完全沒有後續互動",
      "你在等待他的主動聯繫"
    ],
    "uncertainty_note": "目前只能觀察到他選擇不回應，但無法確定背後的考量或時間長度。",
    "paid_teaser": "想知道現在該主動還是繼續等？解鎖看三種不同回應策略。"
  },
  "insight_layer": {
    "title": "沉默中的期待循環",
    "explanation": "當對方突然沉默，你一邊告訴自己不要太在意，一邊又忍不住每次手機響都期待是他。這種「表面平靜，內心等待」的狀態，其實比直接被拒絕更消耗心力。",
    "principle": "模糊沉默的心理拉扯",
    "user_facing": true
  },
  "paid_preview": {
    "headline": "解鎖下一句怎麼回",
    "price": "NT$49",
    "included_sections": [
      "現在最不該做的一件事",
      "三種破冰方式比較",
      "怎麼測試但不顯得急躁",
      "如果他繼續沉默該如何調整心態"
    ],
    "preview_copy": "解鎖後你會看到：現在最不該做的一件事、三種破冰方式比較，以及怎麼測試對方的回應意願但不讓自己顯得急躁。"
  },
  "paid_result": {
    "deeper_signal_analysis": "他選擇已讀不回，可能代表他需要時間思考，或者暫時不知道怎麼回應。這種沉默不一定是拒絕，但確實顯示他現在沒有主動維持對話的動力。你的反應很正常：表面維持日常，內心卻在等待，這說明這段關係對你來說有一定重要性。",
    "possible_interpretation": "對方可能在觀望、忙碌、或者不確定怎麼回應。你的期待心理顯示你們之前的互動讓你建立了某種期望，現在這個期望暫時被打斷了。",
    "risk_warning": "繼續等待而不採取任何行動，可能會讓你陷入更深的內心糾結。過度解讀他的沉默，或者突然發很多訊息，都可能增加壓力。",
    "what_not_to_do": [
      "連續發訊息追問為什麼不回",
      "在社群發暗示性貼文想引起他注意",
      "問共同朋友關於他的消息",
      "假裝生氣或冷淡來測試反應"
    ],
    "reply_strategies": {
      "主動推進": "過幾天後，用輕鬆的方式重新開啟對話，例如分享一個有趣的事情或問一個不需要深度回應的問題。不要直接提到之前的沉默。",
      "低壓試探": "用一個簡單的emoji或者「最近好嗎？」這種開放式問候，給他一個容易回應的機會，同時觀察他的反應速度和內容。",
      "暫時拉開": "專注在自己的生活上，不主動聯繫。如果他之後主動找你，再自然地回應。這段時間用來觀察自己對這段關係的依賴程度。"
    }
  },
  "share_card": {
    "temperature_label": "25°C",
    "state_label": "冷處理觀望",
    "relationship_persona": "沉默期待型",
    "card_sentence": "你不是想太多，只是在沉默裡聽見了自己的期待聲音。"
  },
  "personal_pattern_candidate": {
    "pattern": "使用者在對方沒有回應時，會表面維持正常生活但內心持續關注和期待，顯示對不確定狀態的敏感度較高。",
    "confidence": "medium",
    "evidence": "用戶明確描述表面照常但內心期待，以及每次手機響都會想到對方的反應模式。",
    "should_store": false,
    "user_facing_summary": "你很容易在等待回應時保持表面平靜，但內心其實很在意。這種敏感讓你能察覺關係變化，但也可能讓等待變得更煎熬。"
  },
  "metadata": {
    "situation_type": "已讀不回",
    "input_length": 67,
    "generated_at": "2026-05-16T14:09:48.496765+00:00",
    "experiment_id": "ambiguous-temperature-fake-door-v0",
    "variant": "B",
    "model_provider": "anthropic",
    "model_name": "claude-sonnet-4-20250514"
  }
}
