{
  "free_result": {
    "temperature_score": 52,
    "state_label": "忽冷忽熱",
    "one_sentence_read": "你在他的優先順序裡，但位置會隨著他的狀態浮動。",
    "observed_signals": [
      "有空時會聊很多甚至顯得依賴",
      "忙碌時完全沒有互動",
      "關注度隨對方時間狀態變化很大"
    ],
    "uncertainty_note": "這種模式可能是他的互動習慣，也可能反映你們關係的定位還不夠穩定。",
    "paid_teaser": "想知道這種忽冷忽熱背後代表什麼，以及怎麼回應不會讓自己越來越被動？"
  },
  "insight_layer": {
    "title": "空檔陪伴的兩面性",
    "explanation": "當一個人只在有空時才想起你，這確實會讓人懷疑自己的位置。但有些人就是這樣區分「專心模式」和「社交模式」，不一定代表你不重要。關鍵是這種模式讓你感覺不穩定，而你需要的可能是更一致的關注。",
    "principle": "互動節奏不對等",
    "user_facing": true
  },
  "paid_preview": {
    "headline": "解鎖下一句怎麼回",
    "price": "NT$49",
    "included_sections": [
      "現在最不該做的一件事",
      "三種測試對方投入度的方法",
      "怎麼建立更穩定的互動節奏"
    ],
    "preview_copy": "解鎖後你會看到：現在最不該做的一件事、三種測試對方投入度的方法，以及怎麼建立更穩定的互動節奏而不顯得太需要。"
  },
  "paid_result": {
    "deeper_signal_analysis": "他在有空時對你的依賴感，其實證明了你對他有價值。但這種「開關式」的互動模式，讓你感覺像是他情緒需求的出口，而不是他生活中穩定存在的人。這種落差會讓人特別在意自己的位置。",
    "possible_interpretation": "目前訊號顯示你們的互動更像是「需要時的陪伴」而非「持續的連結」。這不代表他不在乎你，但可能表示你們的關係定位還沒有發展到讓他在忙碌時也會想到你的程度。",
    "risk_warning": "如果你開始質疑自己的價值，很容易在他下次主動時變得冷淡或試探，這可能會破壞你們原本自然的相處模式。",
    "what_not_to_do": [
      "直接質問為什麼忙的時候不理你",
      "在他主動時表現冷淡來測試他",
      "開始計算誰先開口或回覆時間"
    ],
    "reply_strategies": {
      "主動推進": "在他忙碌期間偶爾傳一些不需要回覆的內容，例如「看到這個想到你，不用回」，測試他是否願意回應不急迫的關心。",
      "低壓試探": "下次他有空主動找你時，可以輕鬆地說「最近好像很忙？」然後觀察他會不會主動解釋或表達對之前沒聯絡的在意。",
      "暫時拉開": "保持現有的回應熱度，但開始建立自己的生活節奏，不要完全配合他的「有空-忙碌」週期，讓他感受到你也有自己的優先順序。"
    }
  },
  "share_card": {
    "temperature_label": "52°C",
    "state_label": "忽冷忽熱",
    "relationship_persona": "優先順序觀察家",
    "card_sentence": "你看見的不是他不在乎，而是你在他心中的位置還在浮動。"
  },
  "personal_pattern_candidate": {
    "pattern": "使用者容易在對方互動模式不穩定時，開始懷疑自己在關係中的價值和定位。",
    "confidence": "medium",
    "evidence": "從「開始懷疑自己是不是只是消遣對象」可以看出，當對方的關注不一致時，使用者傾向於質疑自己的重要性而非對方的互動習慣。",
    "should_store": false,
    "user_facing_summary": "你很容易從對方的回應模式中讀出自己的價值，這份敏感讓你能察覺關係變化，但也可能讓你過度解讀對方的優先順序。"
  },
  "metadata": {
    "situation_type": "忽冷忽熱",
    "input_length": 64,
    "generated_at": "2026-05-16T14:13:17.921211+00:00",
    "experiment_id": "ambiguous-temperature-fake-door-v0",
    "variant": "B",
    "model_provider": "anthropic",
    "model_name": "claude-sonnet-4-20250514"
  }
}
