{
  "free_result": {
    "temperature_score": 52,
    "state_label": "深夜熱聊白天降溫",
    "one_sentence_read": "昨晚的熱度像深夜專屬的秘密，白天的淡回應又像回到日常的安全距離。",
    "observed_signals": [
      "深夜聊到凌晨兩點且語氣親近",
      "白天只回「哈哈」「嗯嗯」等短回應",
      "互動溫度在時間點上有明顯落差"
    ],
    "uncertainty_note": "目前只能看到一天的溫差變化，需要觀察更多天的互動模式才能判斷這是偶然還是習慣。",
    "paid_teaser": "解鎖：怎麼延續深夜熱度到白天，還有三種回應策略不讓溫差變尷尬。"
  },
  "insight_layer": {
    "title": "深夜親密白天疏離現象",
    "explanation": "很多人在深夜時情感防線會降低，更容易表達親近感。但白天回到日常節奏時，可能會自然地調整回比較中性的互動模式。這種溫差不一定代表後悔或冷淡，更像是不同時段的不同人格面向。",
    "principle": "時段性親密落差",
    "user_facing": true
  },
  "paid_preview": {
    "headline": "解鎖下一句怎麼回",
    "price": "NT$49",
    "included_sections": [
      "現在最不該做的一件事",
      "三種不破壞氛圍回法",
      "怎麼測試對方白天也想保持熱度",
      "如何延續深夜親密感到日常"
    ],
    "preview_copy": "深夜熱聊白天冷回應是常見現象，但你的下一步回應會決定這個溫差是暫時的還是變成固定模式。"
  },
  "paid_result": {
    "deeper_signal_analysis": "這個溫差模式很常見：深夜時大家比較放鬆，容易進入親密對話模式，但白天回到工作日常時，很多人會自動切換到比較收斂的互動方式。重點是他還是有回應，只是用比較簡短的方式，這通常不是刻意冷落，而是不同時段的不同互動習慣。",
    "possible_interpretation": "對方可能在白天有其他專注事項，或是習慣把親密互動留在比較私密的時間點。也有可能是對昨晚的親近程度需要一些時間消化，所以暫時用比較中性的方式回應。",
    "risk_warning": "如果直接質問為什麼白天變冷淡，可能會讓對方覺得壓力很大，反而破壞了昨晚建立的親近感。",
    "what_not_to_do": [
      "直接問他為什麼白天回得這麼冷",
      "立刻模仿他的短回應變得很冷淡",
      "一直傳訊息想要重現昨晚的熱度"
    ],
    "reply_strategies": {
      "主動推進": "用輕鬆的方式延續昨晚的話題，例如：「想到你昨天說的那個，突然覺得好好笑」，測試他是否願意重新進入比較親近的對話。",
      "低壓試探": "傳一些不需要長回應的內容，像是有趣圖片或日常小事，觀察他的回應方式是否只在特定時間點比較熱絡。",
      "暫時拉開": "配合他目前的節奏，也用比較輕鬆簡短的方式回應，讓互動壓力降低，等他主動回到比較熱絡的模式。"
    }
  },
  "share_card": {
    "temperature_label": "52°C",
    "state_label": "深夜熱聊白天降溫",
    "relationship_persona": "溫差敏感觀察家",
    "card_sentence": "你看見的不是變心，而是時間帶來的不同面貌。"
  },
  "personal_pattern_candidate": {
    "pattern": "使用者對互動溫差變化很敏感，容易在短時間內察覺對方回應方式的改變並尋求解讀。",
    "confidence": "medium",
    "evidence": "能清楚描述昨晚深夜親近互動與今日白天簡短回應的對比，並且對這種溫差變化感到困惑需要解讀。",
    "should_store": false,
    "user_facing_summary": "你很容易注意到對話氛圍的細微變化，這份敏感讓你能及早發現互動的節奏shift，但有時候也會讓正常的溫差變化看起來像是關係訊號。"
  },
  "metadata": {
    "situation_type": "忽冷忽熱",
    "input_length": 64,
    "generated_at": "2026-05-16T14:10:18.129431+00:00",
    "experiment_id": "ambiguous-temperature-fake-door-v0",
    "variant": "B",
    "model_provider": "anthropic",
    "model_name": "claude-sonnet-4-20250514"
  }
}
