{
  "free_result": {
    "temperature_score": 52,
    "state_label": "忽冷忽熱",
    "one_sentence_read": "你們的互動就像在拔河，他會來找你但又不想太深入，你們都在測試對方的底線。",
    "observed_signals": [
      "你不主動時他偶爾會來找你",
      "你認真回應時他反而冷下去",
      "互動節奏呈現拉扯狀態"
    ],
    "uncertainty_note": "目前的模式顯示他有互動意願，但投入度還不穩定，需要更多互動觀察才能判斷方向。",
    "paid_teaser": "解鎖完整分析，看懂這種拉扯背後的訊號，以及你現在最適合的回應方式。"
  },
  "insight_layer": {
    "title": "拉扯型互動",
    "explanation": "讓你焦慮的不是他的冷熱，而是你感覺到他在測試距離，而你也在回測。這種互動會讓雙方都處在試探狀態，很難找到舒服的節奏。",
    "principle": "互動距離試探",
    "user_facing": true
  },
  "paid_preview": {
    "headline": "解鎖下一句怎麼回",
    "price": "NT$49",
    "included_sections": [
      "現在最不該做的一件事",
      "三種不失控回法",
      "怎麼測對方投入度但不把自己放低"
    ],
    "preview_copy": "解鎖後你會看到：現在最不該做的一件事、三種不失控回法，以及怎麼測對方投入度但不把自己放低。"
  },
  "paid_result": {
    "deeper_signal_analysis": "這個模式很典型：他需要感覺到你在那邊，但又不想承受太多期待壓力。你認真回應時他退縮，可能是因為感覺到關係要往下一階段走，但他還沒準備好。重點是他還是會主動來找你，代表完全沒有互動意願是不對的。",
    "possible_interpretation": "目前訊號偏向：他對你有興趣但還在觀望階段，可能在評估自己的投入意願，或是擔心太快推進會有壓力。這種拉扯通常代表他需要時間和空間來確認自己的想法。",
    "risk_warning": "現在最大的風險是陷入過度解讀每一次互動的循環。如果你開始計算他每次的回應溫度，反而會讓自己越來越緊張，也可能在回應時透露出這種緊張感。",
    "what_not_to_do": [
      "不要直接問他「你到底什麼意思」",
      "不要刻意冷淡來測試他的反應",
      "不要每次都回得很認真很長"
    ],
    "reply_strategies": {
      "主動推進": "偶爾提出輕鬆的邀約，但不要太頻繁。如果他沒接，就當作一般朋友互動繼續。重點是讓他感覺沒壓力，但知道你是開放的。",
      "低壓試探": "保持現有的回應模式，但稍微降低認真程度。用輕鬆、不需要太多回應的內容，觀察他是否會主動延續話題。",
      "暫時拉開": "減少主動聯絡的頻率，但維持友善回應。給彼此一些空間，看他是否會更主動來找你，或是互動自然淡掉。"
    }
  },
  "share_card": {
    "temperature_label": "52°C",
    "state_label": "忽冷忽熱",
    "relationship_persona": "拉扯觀察型",
    "card_sentence": "你看見的不是矛盾，而是兩個人都在小心翼翼地測試距離。"
  },
  "personal_pattern_candidate": {
    "pattern": "使用者在面對不確定的互動訊號時，容易將每個選擇都框架成有風險的決定，傾向尋求明確的行動指引。",
    "confidence": "medium",
    "evidence": "使用者明確表達「每一種選擇都像有風險」以及「到底該往前還是該收回」的決策焦慮。",
    "should_store": false,
    "user_facing_summary": "你很習慣把互動當作需要策略的事情，這份謹慎能保護你不會太衝動，但有時也可能讓自然的感覺變複雜。"
  },
  "metadata": {
    "situation_type": "忽冷忽熱",
    "input_length": 75,
    "generated_at": "2026-05-16T14:14:14.917938+00:00",
    "experiment_id": "ambiguous-temperature-fake-door-v0",
    "variant": "B",
    "model_provider": "anthropic",
    "model_name": "claude-sonnet-4-20250514"
  }
}
