{
  "free_result": {
    "temperature_score": 52,
    "state_label": "拉扯循環",
    "one_sentence_read": "你們陷入了一種微妙的距離拉扯，彼此都在用進退控制節奏。",
    "observed_signals": [
      "對方會在你準備放棄時主動找你",
      "你一回溫對方就退掉一點",
      "形成了進退循環模式"
    ],
    "uncertainty_note": "這種拉扯模式可能來自雙方都在試探安全距離，但也需要觀察更長期的互動才能確定。",
    "paid_teaser": "想知道如何在這種拉扯中找到自己的節奏，不被對方的進退牽著走嗎？"
  },
  "insight_layer": {
    "title": "拉扯節奏裡的心理距離",
    "explanation": "當兩個人都在用進退來測試關係的安全距離時，很容易形成這種拉扯循環。你退他進，你進他退，表面上像是遊戲，實際上可能是雙方都還沒找到舒適的互動距離。",
    "principle": "互動距離測試",
    "user_facing": true
  },
  "paid_preview": {
    "headline": "解鎖下一句怎麼回",
    "price": "NT$49",
    "included_sections": [
      "打破拉扯循環的三個方法",
      "如何不被對方節奏帶著走",
      "保持自己步調的回應策略"
    ],
    "preview_copy": "解鎖後你會看到：打破拉扯循環的三個方法、如何不被對方節奏帶著走，以及保持自己步調的回應策略。"
  },
  "paid_result": {
    "deeper_signal_analysis": "這種一進一退的模式通常出現在雙方都還在探索關係邊界的階段。對方可能也在觀察你的反應，想知道你對這段關係的投入程度。當你準備退縮時他主動，可能是他感受到了距離變化；當你回溫時他退開，可能是他需要重新評估這個距離對他來說是否舒適。",
    "possible_interpretation": "目前看起來雙方都還沒找到穩定的互動節奏，你們都在用進退來測試對方的底線和自己的舒適圈。這不一定代表他不喜歡你，但確實顯示他對於親密度的掌控還比較謹慎。",
    "risk_warning": "如果你完全跟著他的節奏走，可能會讓自己變得被動，也可能讓這個拉扯循環繼續下去。重點是要建立自己的互動節奏，而不是只回應他的進退。",
    "what_not_to_do": [
      "不要每次都立刻回應他的主動，這會讓拉扯模式持續",
      "不要因為他退開就馬上也退開，這樣會讓互動變得更不穩定",
      "不要直接質問他為什麼這樣進進退退"
    ],
    "reply_strategies": {
      "主動推進": "在他下次主動找你時，保持溫和但穩定的回應節奏，不要因為他之前退開就冷淡，但也不要過度熱絡。讓他感受到你的穩定性。",
      "低壓試探": "嘗試在他沒有主動的時候，用輕鬆的方式分享一些日常，觀察他是否會主動延續話題，而不是只有在你準備放棄時才出現。",
      "暫時拉開": "建立自己的回訊節奏，不要完全跟著他的進退走。當他主動時適度回應，但不用立刻回到很熱絡的狀態，讓他習慣你也有自己的步調。"
    }
  },
  "share_card": {
    "temperature_label": "52°C",
    "state_label": "拉扯循環",
    "relationship_persona": "進退節奏觀察家",
    "card_sentence": "你感受到的不是冷漠，而是一種小心翼翼的距離探索。"
  },
  "personal_pattern_candidate": {
    "pattern": "使用者容易在對方進退變化時失去自己的互動節奏，傾向跟著對方的步調調整自己的投入程度。",
    "confidence": "medium",
    "evidence": "明確描述了對方進退時自己的回應模式，以及對於無法拿捏自己節奏的困擾。",
    "should_store": true,
    "user_facing_summary": "你很容易察覺到對方的進退變化，這種敏感度讓你能快速回應，但有時也會讓你的節奏被對方牽著走。"
  },
  "metadata": {
    "situation_type": "忽冷忽熱",
    "input_length": 61,
    "generated_at": "2026-05-16T14:12:49.170634+00:00",
    "experiment_id": "ambiguous-temperature-fake-door-v0",
    "variant": "B",
    "model_provider": "anthropic",
    "model_name": "claude-sonnet-4-20250514"
  }
}
