{
  "free_result": {
    "temperature_score": 58,
    "state_label": "忽冷忽熱循環",
    "one_sentence_read": "他用一種若即若離的節奏把你鎖在期待裡，每次快要放下時又被重新點燃。",
    "observed_signals": [
      "連續熱聊後突然消失",
      "在你快放下時主動回來",
      "重複的消失-回歸循環"
    ],
    "uncertainty_note": "這種模式背後可能是忙碌、猶豫，或習慣保持距離，但僅憑互動節奏很難確定原因。",
    "paid_teaser": "想知道怎麼打破這種讓人疲累的循環嗎？"
  },
  "insight_layer": {
    "title": "忽冷忽熱的心理磁場",
    "explanation": "真正讓人累的不是被冷落，而是那種「剛好不會完全失去，但也永遠得不到安定」的懸浮感。這種節奏會讓你的注意力一直被拉扯，因為每次的回歸都會重新激活期待。",
    "principle": "間歇性增強循環",
    "user_facing": true
  },
  "paid_preview": {
    "headline": "解鎖下一句怎麼回",
    "price": "NT$49",
    "included_sections": [
      "現在最不該做的一件事",
      "三種打破循環的回法",
      "怎麼測試對方是否願意穩定靠近"
    ],
    "preview_copy": "解鎖後你會看到：現在最不該做的一件事、三種打破循環的回法，以及怎麼測試對方是否願意穩定靠近而不是只想保持這種距離。"
  },
  "paid_result": {
    "deeper_signal_analysis": "他建立了一個讓你無法完全放下的互動模式：每次消失的時間長度剛好讓你開始懷疑，但又不會讓你徹底死心，然後在你情緒快要抽離時重新出現。這種節奏說明他有能力主動聯繫，但選擇用間歇的方式維持連結。",
    "possible_interpretation": "對方可能習慣這種低承諾但有連結的互動方式，或者他在測試你的耐心和投入度。也有可能他自己對關係進展有矛盾感，所以用這種方式保持安全距離。",
    "risk_warning": "如果你一直配合這種節奏，可能會讓他以為你接受這種不穩定的互動方式，反而強化了這個循環。",
    "what_not_to_do": [
      "不要在他消失時傳訊息追問或表達不滿",
      "不要在他回來時立刻熱情回應，好像什麼都沒發生",
      "不要試圖用同樣忽冷忽熱的方式回應他"
    ],
    "reply_strategies": {
      "主動推進": "直接但溫和地提出你需要更穩定的互動節奏。可以這樣回：「我滿喜歡跟你聊天的，但這種時有時無的感覺讓我有點累，不如我們固定一點時間聊？」",
      "低壓試探": "不配合他的節奏，用平穩的回應測試他是否願意調整。可以這樣回：「歡迎回來～不過我最近比較忙，可能沒辦法像之前那樣隨時聊了。」",
      "暫時拉開": "明確表達你需要空間思考這種互動模式。可以這樣回：「我需要一點時間想清楚我們這樣聊下去是要往哪個方向，先暫停幾天好嗎？」"
    }
  },
  "share_card": {
    "temperature_label": "58°C",
    "state_label": "忽冷忽熱循環",
    "relationship_persona": "間歇性增強偵測型",
    "card_sentence": "你感受到的不是愛，是一種精準的節奏控制。"
  },
  "personal_pattern_candidate": {
    "pattern": "使用者對間歇性的關注模式特別敏感，容易在這種忽冷忽熱的循環中感到疲累但難以抽離。",
    "confidence": "medium",
    "evidence": "明確描述了重複的熱絡-消失-回歸循環，以及「很累但又一直斷不乾淨」的矛盾感受。",
    "should_store": false,
    "user_facing_summary": "你對關係節奏的變化很敏感，這讓你能察覺到不穩定的模式，但也可能讓你在忽冷忽熱中消耗太多能量。"
  },
  "metadata": {
    "situation_type": "忽冷忽熱",
    "input_length": 66,
    "generated_at": "2026-05-16T14:46:14.698246+00:00",
    "experiment_id": "ambiguous-temperature-fake-door-v0",
    "variant": "B",
    "model_provider": "anthropic",
    "model_name": "claude-sonnet-4-20250514"
  }
}
