{
  "free_result": {
    "temperature_score": 52,
    "state_label": "低溫保留",
    "one_sentence_read": "他用最低成本的方式維持連結，既沒有完全離開，也沒有真正靠近。",
    "observed_signals": [
      "回覆速度明顯下降",
      "持續觀看限動",
      "沒有主動發起話題"
    ],
    "uncertainty_note": "看限動可能只是滑手機習慣，也可能是還想關注但不知道怎麼回應。單憑這些訊號還無法確定投入度。",
    "paid_teaser": "現在最需要的是知道下一步該怎麼做，而不是繼續猜測。"
  },
  "insight_layer": {
    "title": "低成本關注的模糊地帶",
    "explanation": "讓你卡住的不是他回得慢，而是他沒有完全消失，卻也沒有穩定靠近。看限動是一種幾乎零壓力的互動方式，既能保持關注，又不用承擔回覆的責任。",
    "principle": "低成本互動訊號",
    "user_facing": true
  },
  "paid_preview": {
    "headline": "解鎖下一句怎麼回",
    "price": "NT$49",
    "included_sections": [
      "現在最不該做的一件事",
      "三種不失控回法",
      "怎麼測對方投入度但不把自己放低"
    ],
    "preview_copy": "解鎖後你會看到：現在最不該做的一件事、三種不失控回法，以及怎麼測對方投入度但不把自己放低。"
  },
  "paid_result": {
    "deeper_signal_analysis": "重點不是他沒看到訊息，而是他有在關注你的生活動態，卻暫時沒有進入雙向對話。這種模式通常代表對方還有一定關注，但可能在觀望或不確定要投入多少。",
    "possible_interpretation": "目前訊號偏向「保持距離但不完全斷線」，可能是因為工作忙碌、情感猶豫，或是在等你的下一步反應。但也不排除他習慣性看限動，沒有特別含義。",
    "risk_warning": "如果直接追問為什麼回得慢，可能會讓對方感到壓力，反而加速降溫。現階段避免讓自己看起來太需要答案。",
    "what_not_to_do": [
      "直接問為什麼回覆變慢",
      "連續發訊息確認他有沒有看到",
      "在限動裡暗示或抱怨他的回覆速度"
    ],
    "reply_strategies": {
      "主動推進": "用輕鬆話題重新啟動對話，不提回覆速度的事。可以這樣說：「剛剛看到一個超好笑的東西，想到你應該會喜歡」然後分享有趣內容。",
      "低壓試探": "用不需要立刻回應的方式測試溫度，比如分享日常但不問問題。可以說：「今天去了那家店，果然跟你說的一樣好吃～」",
      "暫時拉開": "降低發訊息頻率，讓對方有機會主動。專注自己的生活，發一些精彩限動但不特別針對他，看他會不會重新靠近。"
    }
  },
  "share_card": {
    "temperature_label": "52°C",
    "state_label": "低溫保留",
    "relationship_persona": "限動雷達型",
    "card_sentence": "你看見的不是答案，而是節奏的變化。"
  },
  "personal_pattern_candidate": {
    "pattern": "使用者對「低成本互動」很敏感，例如看限動、按讚、短回覆，容易把這些當成關係訊號進行解讀。",
    "confidence": "medium",
    "evidence": "使用者特別注意到對方看限動這個細節，並且會思考這種行為背後的含義",
    "should_store": false,
    "user_facing_summary": "你很容易注意到互動裡的小變化，這份敏感有時能保護你，但也可能讓模糊訊號變得更吵。"
  },
  "metadata": {
    "situation_type": "回訊變慢但看限動",
    "input_length": 67,
    "generated_at": "2026-05-16T14:37:59.179644+00:00",
    "experiment_id": "ambiguous-temperature-fake-door-v0",
    "variant": "B",
    "model_provider": "anthropic",
    "model_name": "claude-sonnet-4-20250514"
  }
}
