{
  "free_result": {
    "temperature_score": 52,
    "state_label": "回應節奏降溫",
    "one_sentence_read": "互動溫度還在，但節奏明顯從熱切變成保留。",
    "observed_signals": [
      "回覆時間從秒回變成半天以上",
      "內容品質還在但順暢度下降",
      "互動節奏明顯放慢"
    ],
    "uncertainty_note": "節奏變化可能有很多原因，需要更多上下文才能確定是暫時忙碌還是關係調整。",
    "paid_teaser": "想知道這種節奏變化代表什麼，以及下一步該怎麼應對嗎？"
  },
  "insight_layer": {
    "title": "節奏變化的訊號解讀",
    "explanation": "讓你不安的不是對方完全消失，而是那種「還在，但不一樣了」的感覺。從秒回到半天，這種節奏落差會讓人特別敏感，因為你能清楚感受到投入度的變化。",
    "principle": "回覆節奏不對等",
    "user_facing": true
  },
  "paid_preview": {
    "headline": "解鎖下一句怎麼回",
    "price": "NT$49",
    "included_sections": [
      "現在最不該做的一件事",
      "三種不失控回法",
      "怎麼測對方投入度但不把自己放低"
    ],
    "preview_copy": "解鎖後你會看到：現在最不該做的一件事、三種不失控回法，以及怎麼測對方投入度但不把自己放低。"
  },
  "paid_result": {
    "deeper_signal_analysis": "從秒回到半天，但內容品質沒有完全下降，這種模式通常代表對方還是願意回應你，但投入的即時性降低了。這可能是生活重心轉移，也可能是在調整你們的互動距離。",
    "possible_interpretation": "對方可能在重新評估你們的關係節奏，或是生活中出現了其他優先事項。目前訊號偏向降溫觀望，但還沒有到完全退出的程度。",
    "risk_warning": "最大風險是你開始頻繁追問或刻意加快回覆來彌補節奏差，這樣反而會讓壓力集中到你身上。",
    "what_not_to_do": [
      "不要刻意秒回來對比他的慢回",
      "不要直接問「你是不是對我沒興趣了」",
      "不要在他還沒回的時候又傳新訊息"
    ],
    "reply_strategies": {
      "主動推進": "保持自然節奏但偶爾主動開話題：不刻意配合他的慢，也不刻意秒回，用正常語調聊點輕鬆的。例如：「最近好像都很忙？我也是，不過剛剛看到一個蠻有趣的東西想分享。」",
      "低壓試探": "用不需要立刻回應的方式測試溫度：分享一些他可回可不回的內容，觀察他的反應模式。例如：「分享一下今天的小日常，你有空再看～」",
      "暫時拉開": "讓自己的回覆節奏也稍微放慢：不是賭氣不回，而是讓互動回到比較平衡的狀態。例如等他回了之後，你也不用馬上回，過個幾小時再自然回應。"
    }
  },
  "share_card": {
    "temperature_label": "52°C",
    "state_label": "回應節奏降溫",
    "relationship_persona": "節奏變化偵測型",
    "card_sentence": "你感受到的不是冷漠，而是節拍的改變。"
  },
  "personal_pattern_candidate": {
    "pattern": "使用者對互動節奏變化很敏感，特別是從高頻轉向低頻時會產生不安全感。",
    "confidence": "medium",
    "evidence": "能清楚描述從秒回到半天的變化，並且會將節奏變化解讀為關係狀態的指標。",
    "should_store": false,
    "user_facing_summary": "你對互動節奏很敏感，這份敏銳讓你能早期發現關係變化，但也可能讓你在正常的節奏調整中感到不安。"
  },
  "metadata": {
    "situation_type": "回訊變慢但看限動",
    "input_length": 64,
    "generated_at": "2026-05-16T14:39:19.218607+00:00",
    "experiment_id": "ambiguous-temperature-fake-door-v0",
    "variant": "B",
    "model_provider": "anthropic",
    "model_name": "claude-sonnet-4-20250514"
  }
}
