{
  "free_result": {
    "temperature_score": 52,
    "state_label": "溫差劇烈",
    "one_sentence_read": "昨天的親近感今天突然降溫，讓你困在不知道該進還是退的位置上。",
    "observed_signals": [
      "昨天深夜聊天語氣曖昧",
      "今天突然變成敷衍式短回覆",
      "回覆內容從有溫度變成哈哈、嗯嗯"
    ],
    "uncertainty_note": "一天的溫差變化無法確定是後悔、忙碌還是其他原因，需要更多互動才能判斷。",
    "paid_teaser": "解鎖看見：為什麼忽冷忽熱最讓人卡住，以及現在怎麼回才不會顯得太在意。"
  },
  "insight_layer": {
    "title": "溫差焦慮",
    "explanation": "讓你真正不安的不是他今天冷淡，而是昨天和今天的巨大落差。當關係溫度突然變化時，人很自然會開始檢討自己是不是做錯了什麼。",
    "principle": "關係溫差不確定感",
    "user_facing": true
  },
  "paid_preview": {
    "headline": "解鎖下一句怎麼回",
    "price": "NT$49",
    "included_sections": [
      "為什麼溫差最讓人焦慮",
      "現在最不該做的兩件事",
      "三種不失控回法",
      "怎麼測試但不顯得太在意"
    ],
    "preview_copy": "忽冷忽熱最容易讓人亂了節奏。解鎖後看到：為什麼溫差比單純冷淡更難處理，現在最不該做的兩件事，以及怎麼回應才不會顯得太在意。"
  },
  "paid_result": {
    "deeper_signal_analysis": "昨天深夜聊天代表當下他是有投入感的，但今天的短回覆顯示投入度明顯下降。這種一夜之間的溫差，通常不是因為你說錯話，更可能是他在日光下重新評估昨晚的親密程度，或者單純今天有其他事情影響心情。",
    "possible_interpretation": "目前訊號偏向他在調節互動節奏，可能是覺得昨天太快太近了，需要一點空間重新找平衡。但這不代表他完全退出，只是暫時降溫。",
    "risk_warning": "現在直接問他怎麼了或追究昨今差異，會讓壓力集中到你身上，可能推得他更遠。",
    "what_not_to_do": [
      "直接問「你怎麼突然變冷了」",
      "用同樣敷衍的語氣回擊他"
    ],
    "reply_strategies": {
      "主動推進": "保持輕鬆語調分享日常，不提昨天的差異，讓他看到你的穩定感",
      "低壓試探": "偶爾問個需要稍微多字回答的問題，測試他的回應意願",
      "暫時拉開": "回覆頻率稍微放慢，給他空間也給自己喘息"
    }
  },
  "share_card": {
    "temperature_label": "52°C",
    "state_label": "溫差劇烈",
    "relationship_persona": "溫差敏感觀察者",
    "card_sentence": "你感受到的不是冷淡，而是溫度的落差。"
  },
  "personal_pattern_candidate": {
    "pattern": "使用者對關係溫度變化很敏感，容易在互動熱度突然下降時進入自我檢討模式",
    "confidence": "medium",
    "evidence": "從昨天曖昧聊天到今天冷淡回覆的落差讓使用者立即開始反思是否自己說錯話",
    "should_store": false,
    "user_facing_summary": "你很容易察覺關係溫度的變化，這份敏感讓你能提早注意到訊號，但有時也會讓你太快承擔責任。"
  },
  "metadata": {
    "situation_type": "忽冷忽熱",
    "input_length": 61,
    "generated_at": "2026-05-16T12:54:39.495736+00:00",
    "experiment_id": "ambiguous-temperature-fake-door-v0",
    "variant": "B",
    "model_provider": "anthropic",
    "model_name": "claude-sonnet-4-20250514"
  }
}
