{
  "free_result": {
    "temperature_score": 48,
    "state_label": "低成本互動模式",
    "one_sentence_read": "他願意保持連結，但選擇在最輕鬆的地方回應你。",
    "observed_signals": [
      "私訊回覆變慢",
      "限動回應很快",
      "只在輕互動區域活躍"
    ],
    "uncertainty_note": "這種模式可能代表他想保持距離感，但也可能只是習慣用不同節奏處理不同類型的互動。",
    "paid_teaser": "想知道這種節奏背後的訊號，以及你該如何回應嗎？"
  },
  "insight_layer": {
    "title": "低成本互動的訊號意義",
    "explanation": "當一個人選擇在限動快速回應，卻讓私訊等待，通常代表他想要保持某種程度的連結，但不想承擔深入對話的壓力。限動回應是低風險的互動方式，不需要延續話題，也不會產生期待。",
    "principle": "低成本互動選擇",
    "user_facing": true
  },
  "paid_preview": {
    "headline": "解鎖下一句怎麼回",
    "price": "NT$49",
    "included_sections": [
      "現在最不該做的一件事",
      "三種順勢而為的回應策略",
      "怎麼測試他的投入度邊界"
    ],
    "preview_copy": "這種節奏不是偶然，而是他目前最舒服的互動方式。解鎖後看到：該怎麼順著這個節奏推進，而不是對抗它。"
  },
  "paid_result": {
    "deeper_signal_analysis": "他建立了一個互動邊界：願意在公開、輕鬆的地方回應你，但對需要更多投入的私人對話保持距離。這不代表他不在意你，而是他目前只想在這個舒適圈裡互動。",
    "possible_interpretation": "這種模式通常出現在：他想要保持連結但不確定要投入多深，或是他現在的狀況讓他只能處理輕量的互動。重點是他沒有完全迴避你，只是選擇了一個他覺得安全的互動方式。",
    "risk_warning": "如果你現在直接質問為什麼私訊回得慢，可能會讓他覺得壓力太大而更退縮。他現在的互動模式已經是他的舒適邊界了。",
    "what_not_to_do": [
      "不要在私訊裡追問他為什麼回得慢",
      "不要停止發限動來測試他的反應",
      "不要把限動當成私訊的延伸來使用"
    ],
    "reply_strategies": {
      "主動推進": "在限動互動中偶爾加入一點私人元素，但保持輕鬆。可以這樣回：「你剛剛那個回應好好笑，讓我想到之前那件事～」然後看他會不會延續到私訊。",
      "低壓試探": "順著他的節奏，在限動建立更多連結後再嘗試私訊。可以這樣回：「限動看到你最近好忙，有空的時候聊聊最近怎麼樣～不急」",
      "暫時拉開": "專注在限動互動，暫停主動發私訊，觀察他是否會主動私訊你。可以這樣回：「最近比較忙，但看到你的限動還是會想回應一下」"
    }
  },
  "share_card": {
    "temperature_label": "48°C",
    "state_label": "低成本互動模式",
    "relationship_persona": "限動雷達型",
    "card_sentence": "有些溫暖不在私訊裡，而在那些快速的回應裡。"
  },
  "personal_pattern_candidate": {
    "pattern": "使用者對「低成本互動」很敏感，會仔細觀察對方在不同互動管道的回應差異，容易把這些差異當成關係投入度的指標。",
    "confidence": "medium",
    "evidence": "使用者清楚描述了私訊與限動回應的時間差異，並且對這種差異感到困惑和分裂，顯示她會仔細比較不同互動方式的回應模式。",
    "should_store": false,
    "user_facing_summary": "你很會注意到互動細節的差異，這種敏感度幫你看見別人忽略的訊號，但有時也會讓你在模糊的地方卡得更久。"
  },
  "metadata": {
    "situation_type": "回訊變慢但看限動",
    "input_length": 82,
    "generated_at": "2026-05-16T14:51:50.625443+00:00",
    "experiment_id": "ambiguous-temperature-fake-door-v0",
    "variant": "B",
    "model_provider": "anthropic",
    "model_name": "claude-sonnet-4-20250514"
  }
}
