{
  "free_result": {
    "temperature_score": 42,
    "state_label": "回應節奏改變",
    "one_sentence_read": "他還在線上，但回覆模式確實跟以前不一樣了。",
    "observed_signals": [
      "明明在線上很久但沒回訊息",
      "回覆模式跟以前不同",
      "你開始盯著上線狀態"
    ],
    "uncertainty_note": "單次回覆延遲不能代表全貌，可能有其他原因影響回覆習慣。",
    "paid_teaser": "想知道這種變化代表什麼，以及現在該怎麼回應嗎？"
  },
  "insight_layer": {
    "title": "當熟悉的節奏改變",
    "explanation": "讓你不安的不是他沒回，而是他的回覆節奏跟你習慣的不一樣了。當建立的互動模式突然改變，人很自然會開始找原因，也容易把注意力放在那些看得見的線索上，像是上線狀態。",
    "principle": "互動節奏變化敏感度",
    "user_facing": true
  },
  "paid_preview": {
    "headline": "解鎖下一句怎麼回",
    "price": "NT$49",
    "included_sections": [
      "現在最不該做的一件事",
      "三種不失控回法",
      "怎麼測試回覆意願但不把自己放低"
    ],
    "preview_copy": "解鎖後你會看到：現在最不該做的一件事、三種不失控回法，以及怎麼測試回覆意願但不把自己放低。"
  },
  "paid_result": {
    "deeper_signal_analysis": "重點不是他在不在線上，而是他的回覆優先順序可能改變了。在線但不回，通常代表他現在處理其他事情，或是對這段對話沒有立即回覆的壓力感。這跟以前的模式不同，但不一定代表關係降溫。",
    "possible_interpretation": "目前訊號偏向他的回覆習慣在調整中，可能是生活節奏改變，也可能是對這段互動的投入度有變化。但單從回覆時間很難判斷具體原因。",
    "risk_warning": "現在最危險的是一直盯著上線狀態，這會讓等待感放大，也容易讓你的下一句話帶著等太久的情緒。",
    "what_not_to_do": [
      "不要追問為什麼在線上不回",
      "不要提到你看到他的上線狀態",
      "不要用「你明明在線上」開頭的句子"
    ],
    "reply_strategies": {
      "主動推進": "直接繼續之前的話題，表現得像沒注意到延遲。可以這樣：「對了，剛剛想到那個地方真的滿有趣的，有機會可以去看看。」",
      "低壓試探": "用不需要立刻回覆的輕話題測試他的回應溫度。可以這樣：「最近好嗎～沒有要催你回，只是突然想到你。」",
      "暫時拉開": "先不主動發訊息，讓節奏回到他身上，觀察他是否會主動聯繫。如果他問起，可以說：「最近比較忙，沒有一直看手機。」"
    }
  },
  "share_card": {
    "temperature_label": "42°C",
    "state_label": "回應節奏改變",
    "relationship_persona": "上線狀態觀察員",
    "card_sentence": "你注意到的不是冷淡，而是節奏的微妙變化。"
  },
  "personal_pattern_candidate": {
    "pattern": "使用者對互動節奏變化很敏感，容易透過技術性線索（如上線狀態）來確認關係狀況。",
    "confidence": "medium",
    "evidence": "明確描述注意到回覆模式改變，並且會盯著上線狀態尋找線索",
    "should_store": false,
    "user_facing_summary": "你很容易察覺到互動節奏的變化，這份敏感度能幫你及早發現關係狀況，但也可能讓你過度關注那些技術性的小線索。"
  },
  "metadata": {
    "situation_type": "回訊變慢但看限動",
    "input_length": 69,
    "generated_at": "2026-05-16T14:38:22.833781+00:00",
    "experiment_id": "ambiguous-temperature-fake-door-v0",
    "variant": "B",
    "model_provider": "anthropic",
    "model_name": "claude-sonnet-4-20250514"
  }
}
