{
  "free_result": {
    "temperature_score": 35,
    "state_label": "低溫保留",
    "one_sentence_read": "他有在活動，但把你的對話暫時放著，這是一種選擇性回應。",
    "observed_signals": [
      "傳訊後已讀不回超過半天",
      "同時間有按別人貼文讚",
      "選擇性處理社群互動"
    ],
    "uncertainty_note": "單次互動無法確定長期模式，可能只是暫時忙碌或不知道怎麼回。",
    "paid_teaser": "想知道現在最不該做什麼，以及三種不失控的回應方式？"
  },
  "insight_layer": {
    "title": "選擇性回應的訊號",
    "explanation": "讓你卡住的不是他完全沒空，而是他明顯有時間處理其他互動，卻把你的訊息放著。這種對比會自然讓人開始懷疑自己在對方心中的順位。",
    "principle": "選擇性互動訊號",
    "user_facing": true
  },
  "paid_preview": {
    "headline": "解鎖下一句怎麼回",
    "price": "NT$49",
    "included_sections": [
      "現在最不該做的一件事",
      "三種不失控回法",
      "怎麼測投入度但不把自己放低"
    ],
    "preview_copy": "解鎖後你會看到：現在最不該做的一件事、三種不失控回法，以及怎麼測投入度但不把自己放低。"
  },
  "paid_result": {
    "deeper_signal_analysis": "重點不是他完全沒空，而是他有在社群上活動，卻暫時沒有回你的問候。這代表現在直接追問，可能會讓壓力集中到你身上。他可能在想怎麼回，也可能暫時想保持距離。",
    "possible_interpretation": "目前訊號偏向投入度下降，但單次已讀不回還不能下定論。可能是不知道怎麼回「最近忙不忙」這種開放問題，也可能是暫時想降低互動頻率。",
    "risk_warning": "最大風險是現在追問或重複傳訊，會讓你看起來需要立即回應，反而增加對方的壓力感。",
    "what_not_to_do": [
      "不要再傳一次問他看到了嗎",
      "不要直接問為什麼不回訊息",
      "不要提到你看見他按讚別人的事"
    ],
    "reply_strategies": {
      "主動推進": "等到明天晚上，用具體話題重新開啟對話，避開需要立即承諾的內容。可以這樣回：「今天經過那家店想到你說過想去，菜單看起來真的不錯。」",
      "低壓試探": "用不需要對方立刻回應的輕話題測試溫度，保留雙方的彈性空間。可以這樣回：「最近天氣變化好大，記得保暖～沒急事，你忙的話之後再聊。」",
      "暫時拉開": "先不主動聯絡，觀察對方會不會重新接觸，同時把注意力轉到其他事情上。可以這樣回：「」"
    }
  },
  "share_card": {
    "temperature_label": "35°C",
    "state_label": "低溫保留",
    "relationship_persona": "微訊號觀察家",
    "card_sentence": "你不是想太多，只是你太會看見細節。"
  },
  "personal_pattern_candidate": {
    "pattern": "使用者對「低成本互動」很敏感，例如按讚、社群活動，容易把這些當成關係訊號進行對比分析。",
    "confidence": "medium",
    "evidence": "能注意到對方按讚別人貼文的時間點，並與未回訊息的行為進行對比思考。",
    "should_store": false,
    "user_facing_summary": "你很容易注意到互動裡的小變化，這份敏感有時能保護你，但也可能讓模糊訊號變得更吵。"
  },
  "metadata": {
    "situation_type": "已讀不回",
    "input_length": 69,
    "generated_at": "2026-05-16T14:41:09.091253+00:00",
    "experiment_id": "ambiguous-temperature-fake-door-v0",
    "variant": "B",
    "model_provider": "anthropic",
    "model_name": "claude-sonnet-4-20250514"
  }
}
