{
  "free_result": {
    "temperature_score": 35,
    "state_label": "降溫保留",
    "one_sentence_read": "他有回你，但整個互動能量明顯下降了。",
    "observed_signals": [
      "整天已讀不回後才回一句",
      "回覆內容變短",
      "溫度比以前低"
    ],
    "uncertainty_note": "單看這次互動，訊號偏冷，但需要更多上下文才能判斷這是暫時狀況還是長期趨勢。",
    "paid_teaser": "現在怎麼回決定了接下來的互動節奏。"
  },
  "insight_layer": {
    "title": "溫度落差的真正訊號",
    "explanation": "讓你不安的不是他晚回，而是回來之後那種明顯的距離感。當一個人的回覆模式突然改變，通常代表他對這段互動的投入度正在調整。",
    "principle": "回覆節奏不對等",
    "user_facing": true
  },
  "paid_preview": {
    "headline": "解鎖下一句怎麼回",
    "price": "NT$49",
    "included_sections": [
      "現在最不該做的一件事",
      "三種不失控回法",
      "怎麼測對方投入度但不把自己放低"
    ],
    "preview_copy": "他的回覆模式改變了，你的回應方式也要跟著調整。解鎖後看到具體的回覆策略和最該避免的地雷。"
  },
  "paid_result": {
    "deeper_signal_analysis": "他有回你，說明還沒有完全切斷聯繫，但「昨天太累了」這種解釋型短句，通常是在為距離感找理由。重點不是他累不累，而是他選擇用最低成本的方式回應你。",
    "possible_interpretation": "對方可能正在重新評估這段互動，或是生活中有其他優先順序。目前訊號顯示投入度下降，但還保留著基本的回應禮貌。",
    "risk_warning": "現在直接追問為什麼變冷淡，或要求解釋，很可能會讓對方感受到壓力，進一步拉開距離。",
    "what_not_to_do": [
      "立刻追問為什麼態度變了",
      "用更熱情的訊息試圖拉回溫度",
      "假裝沒注意到變化繼續照常聊天"
    ],
    "reply_strategies": {
      "主動推進": "輕鬆帶過他的解釋，直接提出具體的互動邀請，但語氣要自然不勉強：「沒關係～那今天精神好點了嗎？」",
      "低壓試探": "用同等的簡短回應測試他的反應：「嗯嗯，好好休息」然後觀察他會不會主動延續話題。",
      "暫時拉開": "給他空間，不立刻回覆，或是回得更簡潔，讓他感受到你也在調整互動節奏。"
    }
  },
  "share_card": {
    "temperature_label": "35°C",
    "state_label": "降溫保留",
    "relationship_persona": "溫差觀察員",
    "card_sentence": "你感受到的不是拒絕，而是節奏的改變。"
  },
  "personal_pattern_candidate": {
    "pattern": "使用者對互動溫度的變化很敏感，特別注意回覆內容的質感下降。",
    "confidence": "medium",
    "evidence": "能準確感知到對方從以前「就算忙也不會只丟短句」到現在「整個溫度很低」的變化",
    "should_store": false,
    "user_facing_summary": "你很容易感知到互動裡的溫度變化，這份敏感能幫你提早發現關係訊號，但也要小心不讓自己過度解讀每個細節。"
  },
  "metadata": {
    "situation_type": "已讀不回",
    "input_length": 72,
    "generated_at": "2026-05-16T14:08:32.919327+00:00",
    "experiment_id": "ambiguous-temperature-fake-door-v0",
    "variant": "B",
    "model_provider": "anthropic",
    "model_name": "claude-sonnet-4-20250514"
  }
}
