{
  "free_result": {
    "temperature_score": 52,
    "state_label": "線上熱線下冷",
    "one_sentence_read": "他在聊天裡很主動，但一碰到實際見面就開始閃躲，這種溫差讓你開始質疑這份熱度的深度。",
    "observed_signals": [
      "主動找你聊天且關心近況",
      "提到見面時會模糊帶過",
      "說「再看看」但沒有具體安排"
    ],
    "uncertainty_note": "目前訊號顯示他在線上互動很投入，但對實體見面有保留，不過還需要更多互動來確認這是暫時性還是固定模式。",
    "paid_teaser": "想知道怎麼突破這種「聊天熱但見面冷」的僵局嗎？"
  },
  "insight_layer": {
    "title": "線上親密與實體距離的落差",
    "explanation": "有些人很習慣在聊天裡建立親密感，但面對實體接觸時會自然退縮。你感受到的不是他不喜歡你，而是他可能更習慣在安全的線上空間表達關心。",
    "principle": "數位親密與實體互動落差",
    "user_facing": true
  },
  "paid_preview": {
    "headline": "解鎖下一句怎麼回",
    "price": "NT$49",
    "included_sections": [
      "現在最不該做的一件事",
      "三種推進見面的自然方法",
      "怎麼測試他的實體互動意願但不把自己放低"
    ],
    "preview_copy": "解鎖後你會看到：現在最不該做的一件事、三種推進見面的自然方法，以及怎麼測試他的實體互動意願但不把自己放低。"
  },
  "paid_result": {
    "deeper_signal_analysis": "他主動聊天加上關心近況，顯示對你有一定投入度，但遇到見面就模糊帶過，可能代表他習慣在線上維持關係，或是對實體互動有某種猶豫。重點是他沒有直接拒絕，而是用「再看看」保留可能性。",
    "possible_interpretation": "這種模式通常有幾種可能：他可能正在觀望你們的發展方向、習慣線上互動勝過實體接觸、或是目前生活狀況讓他無法承諾具體見面時間。但他持續主動聊天，顯示你在他心中有一定位置。",
    "risk_warning": "如果一直接受這種「聊天很熱但不見面」的模式，可能會讓你們的關係停留在安全但表淺的層次，也容易讓你開始懷疑自己的價值。",
    "what_not_to_do": [
      "不要直接質問為什麼不想見面",
      "不要一直提見面讓自己顯得急迫",
      "不要因為他線上很熱就忽略實體互動的重要性"
    ],
    "reply_strategies": {
      "主動推進": "下次他關心你近況時，可以自然地說「最近想找個人一起去○○，你有空嗎？」把見面包裝在具體活動裡，降低他的心理壓力。",
      "低壓試探": "可以分享你最近去的有趣地方，然後說「下次可以一起去」，觀察他的反應是更具體回應還是繼續模糊帶過。",
      "暫時拉開": "繼續享受聊天的親密感，但不再主動提見面，讓他感受到如果想要更進一步，需要他來跨出這步。"
    }
  },
  "share_card": {
    "temperature_label": "52°C",
    "state_label": "線上熱線下冷",
    "relationship_persona": "數位親密觀察員",
    "card_sentence": "有些熱度只在螢幕裡發光，你想知道的是它能不能照亮現實。"
  },
  "personal_pattern_candidate": {
    "pattern": "使用者對於線上互動與實體互動的落差很敏感，容易從對方的見面態度判斷關係的深度與可能性。",
    "confidence": "medium",
    "evidence": "使用者明確指出聊天很熱但見面就閃躲的模式，並開始質疑這種熱度的深度",
    "should_store": false,
    "user_facing_summary": "你很敏銳地察覺到線上和線下互動的溫差，這種觀察力幫你看清關係的深度，但也可能讓你過早下定論。"
  },
  "metadata": {
    "situation_type": "忽冷忽熱",
    "input_length": 68,
    "generated_at": "2026-05-16T14:12:19.588425+00:00",
    "experiment_id": "ambiguous-temperature-fake-door-v0",
    "variant": "B",
    "model_provider": "anthropic",
    "model_name": "claude-sonnet-4-20250514"
  }
}
