{
  "free_result": {
    "temperature_score": 52,
    "state_label": "觀望降溫",
    "one_sentence_read": "他沒有完全離開，但主動度明顯下降，你們現在卡在一種「還在但不靠近」的狀態。",
    "observed_signals": [
      "回覆速度明顯變慢",
      "仍會看你的生活動態",
      "保持低成本關注但不主動互動"
    ],
    "uncertainty_note": "這種模式可能代表他還有關注，但投入度下降，也可能只是生活節奏改變，需要更多互動觀察。",
    "paid_teaser": "現在最關鍵的是下一步怎麼走，收回主動權還是低壓試探？"
  },
  "insight_layer": {
    "title": "被溫柔懸著的感覺",
    "explanation": "讓你卡住的不是他回得慢，而是他沒有完全消失，卻也沒有穩定靠近。這種「還在看但不回應」的狀態，會讓人一直想找到確定的答案。",
    "principle": "模糊訊號放大效應",
    "user_facing": true
  },
  "paid_preview": {
    "headline": "解鎖下一句怎麼回",
    "price": "NT$49",
    "included_sections": [
      "現在最不該做的一件事",
      "三種不失控回法",
      "該收回主動還是低壓試探"
    ],
    "preview_copy": "解鎖後你會看到：現在最不該做的一件事、三種不失控回法，以及該收回主動權還是低壓試探的判斷方式。"
  },
  "paid_result": {
    "deeper_signal_analysis": "他還在看你的動態，說明對你保持關注，但回覆變慢代表他現在不想投入更多互動成本。這通常表示他在觀望，可能在等你的反應，或者他自己也還沒想清楚。",
    "possible_interpretation": "目前訊號顯示他的投入度下降，但還沒有完全退出。這種狀態可能維持一段時間，也可能隨時改變，不能只靠現在的互動模式下定論。",
    "risk_warning": "最大的風險是一直等待他主動回溫，或者突然用太直接的方式要答案，這兩種都可能讓現在微妙的平衡被打破。",
    "what_not_to_do": [
      "不要直接問他是不是不想聊了",
      "不要用更頻繁的訊息測試他的反應",
      "不要在他看了動態後馬上傳訊息給他"
    ],
    "reply_strategies": {
      "主動推進": "用輕鬆但有明確邀請的方式測試他的回應意願。可以這樣回：「最近發現一家不錯的店，下週有空的話一起去試試？」",
      "低壓試探": "先降低互動壓力，用不需要他立刻回應的內容保持連結。可以這樣回：「分享個有趣的東西給你～不用回，就是覺得你可能會喜歡。」",
      "暫時拉開": "主動降低自己的期待和頻率，讓他有空間主動靠近。可以這樣回：「我最近會比較忙，有空再聊～」"
    }
  },
  "share_card": {
    "temperature_label": "52°C",
    "state_label": "觀望降溫",
    "relationship_persona": "微訊號觀察家",
    "card_sentence": "你看見的不是答案，而是節奏的變化。"
  },
  "personal_pattern_candidate": {
    "pattern": "使用者對「低成本互動」很敏感，例如看動態但不回覆，容易把這些當成關係訊號並持續解讀。",
    "confidence": "medium",
    "evidence": "使用者明確提到對方看動態的行為讓她無法停下來，並認為這代表還有可能性。",
    "should_store": false,
    "user_facing_summary": "你很容易注意到互動裡的小變化，這份敏感有時能保護你，但也可能讓模糊訊號變得更吵。"
  },
  "metadata": {
    "situation_type": "回訊變慢但看限動",
    "input_length": 76,
    "generated_at": "2026-05-16T14:54:11.274191+00:00",
    "experiment_id": "ambiguous-temperature-fake-door-v0",
    "variant": "B",
    "model_provider": "anthropic",
    "model_name": "claude-sonnet-4-20250514"
  }
}
