{
  "free_result": {
    "temperature_score": 48,
    "state_label": "低成本互動期",
    "one_sentence_read": "他還在你的生活邊緣，但只用最輕的方式存在。",
    "observed_signals": [
      "回訊息頻率明顯下降",
      "持續觀看限動但不主動互動",
      "你開始用發限動測試他的關注度"
    ],
    "uncertainty_note": "看限動代表還有關注，但不回訊息可能有很多原因，需要更多互動才能判斷。",
    "paid_teaser": "想知道這種「看但不回」的訊號背後可能代表什麼，以及你現在最不該做的事？"
  },
  "insight_layer": {
    "title": "被小訊號餵養的等待",
    "explanation": "當主要的互動管道（訊息）變冷時，人很自然會轉向尋找其他訊號來確認自己還存在對方心中。看限動變成了一種「最低成本的關注證明」，但這種小訊號往往讓人更容易卡在不上不下的狀態裡。",
    "principle": "低成本互動訊號依賴",
    "user_facing": true
  },
  "paid_preview": {
    "headline": "解鎖下一句怎麼回",
    "price": "NT$49",
    "included_sections": [
      "現在最不該做的一件事",
      "三種測試對方投入度的方法",
      "怎麼跳出小訊號綁架"
    ],
    "preview_copy": "解鎖後你會看到：為什麼繼續用限動測試可能讓關係更模糊、三種不會把自己放低的試探方式，以及什麼時候該主動打破這種平衡。"
  },
  "paid_result": {
    "deeper_signal_analysis": "他看限動但不回訊息，代表你還在他的關注範圍內，但他目前選擇用「最低成本」的方式維持連結。這不一定是故意冷落，可能是他現在沒有餘裕處理需要回應的互動，但又不想完全切斷。",
    "possible_interpretation": "這種模式通常出現在對方生活有其他重心，或是他對關係節奏有不同期待的時候。重點是他沒有完全消失，但也沒有主動維持原本的互動頻率。",
    "risk_warning": "繼續用發限動來測試他的反應，可能會讓你越來越依賴這些小訊號，而忽略了真正需要關注的是整體互動品質的改變。",
    "what_not_to_do": [
      "不要增加發限動的頻率來測試他",
      "不要直接問他為什麼都不回訊息",
      "不要在限動裡暗示或抱怨他的冷淡"
    ],
    "reply_strategies": {
      "主動推進": "直接但不帶壓力地重新建立訊息互動，用具體但輕鬆的話題。可以這樣回：「最近比較忙嗎？我這邊有個有趣的事想跟你分享，不急著回，有空再聊。」",
      "低壓試探": "暫停用限動測試，改用一次性的輕話題測試他的回應意願。可以這樣回：「看到一個很適合你的東西，但不知道你最近有沒有空看訊息～」",
      "暫時拉開": "停止主動測試，讓關係回到更自然的節奏，觀察他會不會主動靠近。可以這樣回：「我最近也蠻忙的，等大家都比較有空再好好聊。」"
    }
  },
  "share_card": {
    "temperature_label": "48°C",
    "state_label": "低成本互動期",
    "relationship_persona": "小訊號收藏家",
    "card_sentence": "你沒有想太多，只是太會從細節裡找安全感。"
  },
  "personal_pattern_candidate": {
    "pattern": "使用者在主要互動管道變冷時，會轉向收集低成本互動訊號（如限動觀看）來維持心理安全感，但容易因此延長不確定狀態。",
    "confidence": "medium",
    "evidence": "使用者明確描述了在對方不回訊息後，開始頻繁發限動測試對方關注度，並且會因為對方看限動而暫時安心。",
    "should_store": false,
    "user_facing_summary": "你很敏感於各種關注訊號，這讓你能察覺關係裡的細微變化，但有時候也會讓你被小訊號困住而難以看清大方向。"
  },
  "metadata": {
    "situation_type": "回訊變慢但看限動",
    "input_length": 85,
    "generated_at": "2026-05-16T14:41:46.410381+00:00",
    "experiment_id": "ambiguous-temperature-fake-door-v0",
    "variant": "B",
    "model_provider": "anthropic",
    "model_name": "claude-sonnet-4-20250514"
  }
}
